{
  "accessories": [ "accessory-tablet", "accessory-smartwatch" ],
  "characterId": "exec-cio",
  "createdAt": "2026-01-01T00:00:00.000Z",
  "direction": "down",
  "displayName": "Chief Investment Officer",
  "expression": "smile",
  "face": "face-f-02",
  "facialHair": null,
  "facialHairColor": "hair-dark-brown",
  "fitGroup": "feminine-fit",
  "hair": "hair-f-bun",
  "hairColor": "hair-soft-black",
  "headCovering": null,
  "manifestVersion": "1.0.0",
  "materialOverrides": { },
  "modifiedAt": "2026-01-01T00:00:00.000Z",
  "outfitColorway": "burgundy",
  "outfitSystem": "pantsuit",
  "skinPalette": "skin-olive-05",
  "state": "idle"
}