{
  "accessories": [ "accessory-clipboard", "accessory-lanyard" ],
  "characterId": "exec-ops",
  "createdAt": "2026-01-01T00:00:00.000Z",
  "direction": "down",
  "displayName": "Head of Operations",
  "expression": "talk",
  "face": "face-m-02",
  "facialHair": "facialhair-full-beard",
  "facialHairColor": "hair-soft-black",
  "fitGroup": "masculine-fit",
  "hair": "hair-m-cropped-coils",
  "hairColor": "hair-soft-black",
  "headCovering": null,
  "manifestVersion": "1.0.0",
  "materialOverrides": { },
  "modifiedAt": "2026-01-01T00:00:00.000Z",
  "outfitColorway": "navy-tan",
  "outfitSystem": "blazer-trousers",
  "skinPalette": "skin-olive-06-deep",
  "state": "idle"
}