{
  "accessories": [ "accessory-glasses-round", "accessory-briefcase" ],
  "characterId": "exec-advisor",
  "createdAt": "2026-01-01T00:00:00.000Z",
  "direction": "down",
  "displayName": "Senior Advisor",
  "expression": "smile",
  "face": "face-m-04",
  "facialHair": null,
  "facialHairColor": "hair-dark-brown",
  "fitGroup": "masculine-fit",
  "hair": null,
  "hairColor": "hair-dark-brown",
  "headCovering": "headcovering-turban-formal",
  "manifestVersion": "1.0.0",
  "materialOverrides": {
    "headcovering-turban-formal": {
      "palette": "cover-burgundy"
    }
  },
  "modifiedAt": "2026-01-01T00:00:00.000Z",
  "outfitColorway": "charcoal",
  "outfitSystem": "suit-2p",
  "skinPalette": "skin-olive-03",
  "state": "idle"
}